{
  "analysis_sha256": "95d339d015994ab13b1b723f6e36ababccb0c83d1c5826e87c5ddd1784d8bee9",
  "basis": "illustrative_program_comparison",
  "claims": [
    {
      "id": "site.bbl",
      "inputs": [],
      "kind": "fact",
      "label": "Site identity from verified upstream analysis",
      "method": null,
      "rationale": null,
      "references": [
        {
          "file": "analysis-run/ir.json",
          "pointer": "/resolved_bbl",
          "sha256": "95d339d015994ab13b1b723f6e36ababccb0c83d1c5826e87c5ddd1784d8bee9"
        }
      ],
      "unit": "status",
      "value": "2028710002"
    },
    {
      "id": "reference.ami30_income_one",
      "inputs": [],
      "kind": "fact",
      "label": "Historical rounded annual_income_usd at 30% AMI",
      "method": null,
      "rationale": null,
      "references": [
        {
          "excerpt_file": "reference-source/passages.txt",
          "excerpt_sha256": "ec02efd171c803c2e1429868471b602739a4e68e7a448dec99cb3ef1230dcbc4",
          "extraction_method": "nyc-rer-table3-selected-rows@1",
          "page": 6,
          "quote": "30% AMI $34,000 $48,600 $850 $1,090",
          "source_pdf_sha256": "d3cb09347c351a0a52993758018b1b79296adc29ff934e28053f5cd6a949faf1",
          "table": "3",
          "url": "https://www.nyc.gov/assets/planning/downloads/pdf/applicants/preparing-application/rer-instructions.pdf?r=1025a"
        }
      ],
      "unit": "USD per year",
      "value": "34000.00"
    },
    {
      "id": "reference.ami30_income_four",
      "inputs": [],
      "kind": "fact",
      "label": "Historical rounded annual_income_usd at 30% AMI",
      "method": null,
      "rationale": null,
      "references": [
        {
          "excerpt_file": "reference-source/passages.txt",
          "excerpt_sha256": "ec02efd171c803c2e1429868471b602739a4e68e7a448dec99cb3ef1230dcbc4",
          "extraction_method": "nyc-rer-table3-selected-rows@1",
          "page": 6,
          "quote": "30% AMI $34,000 $48,600 $850 $1,090",
          "source_pdf_sha256": "d3cb09347c351a0a52993758018b1b79296adc29ff934e28053f5cd6a949faf1",
          "table": "3",
          "url": "https://www.nyc.gov/assets/planning/downloads/pdf/applicants/preparing-application/rer-instructions.pdf?r=1025a"
        }
      ],
      "unit": "USD per year",
      "value": "48600.00"
    },
    {
      "id": "reference.ami30_rent_studio",
      "inputs": [],
      "kind": "fact",
      "label": "Historical rounded reference_monthly_rent_usd at 30% AMI",
      "method": null,
      "rationale": null,
      "references": [
        {
          "excerpt_file": "reference-source/passages.txt",
          "excerpt_sha256": "ec02efd171c803c2e1429868471b602739a4e68e7a448dec99cb3ef1230dcbc4",
          "extraction_method": "nyc-rer-table3-selected-rows@1",
          "page": 6,
          "quote": "30% AMI $34,000 $48,600 $850 $1,090",
          "source_pdf_sha256": "d3cb09347c351a0a52993758018b1b79296adc29ff934e28053f5cd6a949faf1",
          "table": "3",
          "url": "https://www.nyc.gov/assets/planning/downloads/pdf/applicants/preparing-application/rer-instructions.pdf?r=1025a"
        }
      ],
      "unit": "USD per month",
      "value": "850.00"
    },
    {
      "id": "reference.ami30_rent_two",
      "inputs": [],
      "kind": "fact",
      "label": "Historical rounded reference_monthly_rent_usd at 30% AMI",
      "method": null,
      "rationale": null,
      "references": [
        {
          "excerpt_file": "reference-source/passages.txt",
          "excerpt_sha256": "ec02efd171c803c2e1429868471b602739a4e68e7a448dec99cb3ef1230dcbc4",
          "extraction_method": "nyc-rer-table3-selected-rows@1",
          "page": 6,
          "quote": "30% AMI $34,000 $48,600 $850 $1,090",
          "source_pdf_sha256": "d3cb09347c351a0a52993758018b1b79296adc29ff934e28053f5cd6a949faf1",
          "table": "3",
          "url": "https://www.nyc.gov/assets/planning/downloads/pdf/applicants/preparing-application/rer-instructions.pdf?r=1025a"
        }
      ],
      "unit": "USD per month",
      "value": "1090.00"
    },
    {
      "id": "reference.ami60_income_one",
      "inputs": [],
      "kind": "fact",
      "label": "Historical rounded annual_income_usd at 60% AMI",
      "method": null,
      "rationale": null,
      "references": [
        {
          "excerpt_file": "reference-source/passages.txt",
          "excerpt_sha256": "ec02efd171c803c2e1429868471b602739a4e68e7a448dec99cb3ef1230dcbc4",
          "extraction_method": "nyc-rer-table3-selected-rows@1",
          "page": 6,
          "quote": "60% AMI $68,000 $97,200 $1,700 $2,190",
          "source_pdf_sha256": "d3cb09347c351a0a52993758018b1b79296adc29ff934e28053f5cd6a949faf1",
          "table": "3",
          "url": "https://www.nyc.gov/assets/planning/downloads/pdf/applicants/preparing-application/rer-instructions.pdf?r=1025a"
        }
      ],
      "unit": "USD per year",
      "value": "68000.00"
    },
    {
      "id": "reference.ami60_income_four",
      "inputs": [],
      "kind": "fact",
      "label": "Historical rounded annual_income_usd at 60% AMI",
      "method": null,
      "rationale": null,
      "references": [
        {
          "excerpt_file": "reference-source/passages.txt",
          "excerpt_sha256": "ec02efd171c803c2e1429868471b602739a4e68e7a448dec99cb3ef1230dcbc4",
          "extraction_method": "nyc-rer-table3-selected-rows@1",
          "page": 6,
          "quote": "60% AMI $68,000 $97,200 $1,700 $2,190",
          "source_pdf_sha256": "d3cb09347c351a0a52993758018b1b79296adc29ff934e28053f5cd6a949faf1",
          "table": "3",
          "url": "https://www.nyc.gov/assets/planning/downloads/pdf/applicants/preparing-application/rer-instructions.pdf?r=1025a"
        }
      ],
      "unit": "USD per year",
      "value": "97200.00"
    },
    {
      "id": "reference.ami60_rent_studio",
      "inputs": [],
      "kind": "fact",
      "label": "Historical rounded reference_monthly_rent_usd at 60% AMI",
      "method": null,
      "rationale": null,
      "references": [
        {
          "excerpt_file": "reference-source/passages.txt",
          "excerpt_sha256": "ec02efd171c803c2e1429868471b602739a4e68e7a448dec99cb3ef1230dcbc4",
          "extraction_method": "nyc-rer-table3-selected-rows@1",
          "page": 6,
          "quote": "60% AMI $68,000 $97,200 $1,700 $2,190",
          "source_pdf_sha256": "d3cb09347c351a0a52993758018b1b79296adc29ff934e28053f5cd6a949faf1",
          "table": "3",
          "url": "https://www.nyc.gov/assets/planning/downloads/pdf/applicants/preparing-application/rer-instructions.pdf?r=1025a"
        }
      ],
      "unit": "USD per month",
      "value": "1700.00"
    },
    {
      "id": "reference.ami60_rent_two",
      "inputs": [],
      "kind": "fact",
      "label": "Historical rounded reference_monthly_rent_usd at 60% AMI",
      "method": null,
      "rationale": null,
      "references": [
        {
          "excerpt_file": "reference-source/passages.txt",
          "excerpt_sha256": "ec02efd171c803c2e1429868471b602739a4e68e7a448dec99cb3ef1230dcbc4",
          "extraction_method": "nyc-rer-table3-selected-rows@1",
          "page": 6,
          "quote": "60% AMI $68,000 $97,200 $1,700 $2,190",
          "source_pdf_sha256": "d3cb09347c351a0a52993758018b1b79296adc29ff934e28053f5cd6a949faf1",
          "table": "3",
          "url": "https://www.nyc.gov/assets/planning/downloads/pdf/applicants/preparing-application/rer-instructions.pdf?r=1025a"
        }
      ],
      "unit": "USD per month",
      "value": "2190.00"
    },
    {
      "id": "policy.cost_threshold_percent",
      "inputs": [],
      "kind": "assumption",
      "label": "Illustrative housing-cost threshold",
      "method": null,
      "rationale": "Illustrative housing-cost-burden convention, not eligibility or a sufficient measure of household welfare.",
      "references": [],
      "unit": "percent",
      "value": "30.00"
    },
    {
      "id": "review.no_action",
      "inputs": [],
      "kind": "unknown",
      "label": "Future without-intervention baseline",
      "method": null,
      "rationale": "Future no-action development has not been established. Program differences are not net additions or causal benefits.",
      "references": [],
      "unit": "status",
      "value": null
    },
    {
      "id": "review.occupancy",
      "inputs": [],
      "kind": "unknown",
      "label": "Existing occupancy and direct losses",
      "method": null,
      "rationale": "Existing occupants, businesses, protections and direct losses remain unresolved. Recorded zero homes cannot clear displacement.",
      "references": [
        {
          "file": "analysis-run/ir.json",
          "sha256": "95d339d015994ab13b1b723f6e36ababccb0c83d1c5826e87c5ddd1784d8bee9",
          "upstream_claim": "unknown.current_use"
        }
      ],
      "unit": "status",
      "value": null
    },
    {
      "id": "review.access",
      "inputs": [],
      "kind": "unknown",
      "label": "Transit opportunity access",
      "method": null,
      "rationale": "No network-access result imported or calculated in this slice. Station proximity is not job access.",
      "references": [],
      "unit": "status",
      "value": null
    },
    {
      "id": "profile.lower_income.annual_income_usd",
      "inputs": [
        "reference.ami30_income_four"
      ],
      "kind": "assumption",
      "label": "Hypothetical annual household income",
      "method": null,
      "rationale": "Hypothetical annual income equal to the rounded historical published threshold, not an observed household or eligibility finding.",
      "references": [],
      "unit": "USD per year",
      "value": "48600.00"
    },
    {
      "id": "profile.lower_income.bedrooms",
      "inputs": [],
      "kind": "assumption",
      "label": "Exact bedroom category for this comparison",
      "method": null,